{
  "schema_version": "1.0",
  "benchmark_id": "physical-gelator",
  "source_sha256": "461d56348e722e0f5aeeafb13b37b9cd8ba227cfe05327cffee050a1ae9f6697",
  "review": {"status": "seed_single_review", "reviewer_count": 1, "reviewed_at": "2026-07-31", "method": "Visual review with local Whisper transcript support"},
  "steps": [
    {"step_id": "step-01", "order": 1, "title": "Heat the sample", "instruction": "Heat the sample while you rotate the closed vial until the solid dissolves.", "start_ms": 0, "end_ms": 60000, "screenshot": {"time_ms": 45000, "region": {"x": 0.08, "y": 0.05, "width": 0.84, "height": 0.9}}},
    {"step_id": "step-02", "order": 2, "title": "Cool the sample", "instruction": "Put the vial upright and let the solution cool until a gel forms.", "start_ms": 60000, "end_ms": 221680, "screenshot": {"time_ms": 210000, "region": {"x": 0.25, "y": 0.05, "width": 0.5, "height": 0.9}}}
  ]
}
